{
  "dates": {
    "maximum": "2023-05-03",
    "minimum": "2023-03-16"
  },
  "page": 1,
  "results": [
    {
      "adult": false,
      "backdrop_path": "/iJQIbOPm81fPEGKt5BPuZmfnA54.jpg",
      "genre_ids": [
        16
      ],
      "id": 502356,
      "original_language": "en",
      "original_title": "The Super Mario Bros. Movie",
      "overview": "While working underground to fix a water main, Brooklyn plumbers\u2014and brothers\u2014Mario and Luigi are transported down a mysterious pipe and wander into a magical new world. But when the brothers are separated, Mario embarks on an epic quest to find Luigi.",
      "popularity": 6572.614,
      "poster_path": "/qNBAXBIQlnOThrVvA6mA2B5ggV6.jpg",
      "release_date": "2023-04-05",
      "title": "The Super Mario Bros. Movie",
      "video": false,
      "vote_average": 7.5,
      "vote_count": 1456
    }
  ],
  "total_pages": 87,
  "total_results": 1734
}